{
  "name": "Marcus Vance",
  "github": "devmarcus",
  "avatar": "https://images.unsplash.com/photo-1500648767791-00dcc994a43e?w=250&auto=format&fit=crop&q=80",
  "bio": "Self-taught developer building developer tools and contributing to beginner-friendly OSS.",
  "skills": ["JavaScript", "Node.js", "Express", "MongoDB", "Linux"],
  "links": {
    "portfolio": "https://marcusvance.io",
    "twitter": "https://x.com/devmarcus"
  },
  "firstPR": "joined via PR #18",
  "joinedDate": "2026-03-14"
}
